{
  "baseline_version": "1.0",
  "baseline_id": "baseline:project-example:v1",
  "version": 1,
  "predecessor_ref": null,
  "project_id": "project-example",
  "worktree_id": "worktree-example",
  "environment_ref": "macos-arm64-python-3.12",
  "profile_ref": "sha256:0000000000000000000000000000000000000000000000000000000000000000",
  "interview_ref": "sha256:1111111111111111111111111111111111111111111111111111111111111111",
  "source_fingerprints": {},
  "sources": [],
  "commands": [],
  "sensitive_paths": [],
  "external_services": [],
  "hwpx_tool_contract": {"basis": "unobserved", "tools": [], "reason": "no supported HWPX tool contract"},
  "unobserved": [{"path": "dynamic-context", "basis": "unobserved", "reason": "dynamic path is unsupported"}],
  "event_refs": ["event-profile"],
  "evidence_refs": ["evidence-profile"],
  "fingerprint": "sha256:4dbabddfc86bd39ccbe80642e76597ffa2555dc52bcc6b94c18adaff3f6e746c"
}
